author,published_at,like_count,text,is_reply
@as46bd16,2025-08-18T09:06:22Z,0,본인이 잘못해놓고 눅한테 뒤집어씌우는거야 생양치보다못한놈,False
@쿠리하리,2025-08-18T09:06:13Z,0,저렇게까지 권력을 남용하네..진짜.,False
@밍밍-v7w,2025-08-18T09:06:12Z,0,자막조작 팻말들고 있던 국힘 창피해라,False
@진해영-q1r,2025-08-18T09:06:03Z,0,입만열면구라  저질,False
@MartinesVPedro-df6gn,2025-08-18T09:06:02Z,0,강훈 니가 언론인이냐? ㅋㅋㅋㅋㅋㅋ 웃기는 놈,False
@dldjdlj,2025-08-18T09:05:42Z,0,미쳐도 보통 미친게 아니라는 소리임 누가 들어도 바이든이라고 들리는데 그걸 날리면 이라면서 소송걸고 저런 미친 인간이 만약 쿠테타 성공해서 지금 계엄상태고 앞으로도 김거니랑 같이 영구집권 했을거 상상을 해보라고,False
@creatorpyo,2025-08-18T09:05:41Z,0,이거 교도소 새로 지어야 될 판이네. 윤건희 똥 뭍은 사람들 다 집어 넣아야죠.,False
@김성식-g9j,2025-08-18T09:04:39Z,1,"하여튼 수구꼴통 내란 똘마니당이 집권만 하면 <br>대한민국 국가 시스템이 엉망진창이 되고, 강압적 독재적 분위기의 과거로 회기됨.<br>국민은 언제나 뒷전이고 언론 앞장세워 거짓 선동하면서 소수의 권력자와 간신들만을 위한 나라를 만들려 하는게 대대로 내려오는 수구 꼴통당의 속성.<br>인물다운 인물 하나 당내에서 제대로 키워내지 못하고, 대선때마다 어디서 자격없고 무능하며 권력만 탐하는 못되먹은 인간들만 골라서 영입한 후 보란듯이 단체로 머슴짓 똘마니짓 시전...<br>대한민국의 미래를 위해서 없어져야 할 무능하고 쓸모없는 내란의 똘마니들이 모인 당......",False
@__4EVER__,2025-08-18T09:03:59Z,0,ㅅㅂ 구석구석 썩었네. 싹다 뿌리 뽑자!!!,False
@Suny7320-l1h,2025-08-18T09:03:57Z,0,국민의힘 국회의원 이란것들은 참....<br>다시봐도 답이없음,False
@낚시하다말다,2025-08-18T09:03:13Z,0,이번 &quot;난리면&quot;  &lt;--  이렇게 주장하거나 편들었던 정치인/ 판사/ 방송/ 신문 &lt;---  이놈들 단 하나 조차도 빠짐없이 철퇴를 내려서 그 본보기를 후대어 반드시 남겨야한다~!!<br>전국민을 희롱한 썩어문드러진 것들이다~~!!<br>절대로 용서하면 안된다~!!,False
@폼생폼사형-j5v,2025-08-18T09:03:06Z,0,우리말 들어봤나?<br>1. 고급휘발유ㅡ고도비만<br>2. 면추리닝이라 ㅡ연출이라<br>3. 클래식 ㅡ 프레시<br>4.,False
@조용빈-z6l,2025-08-18T09:02:49Z,0,판사가 문제야,False
@brandonyoon2171,2025-08-18T09:02:07Z,0,저 10쉐이를 날려버려야 하는데,False
@TV-gp7ld,2025-08-18T09:02:00Z,0,"윤머시기  폐하께서 길길이 날뛰셔서 김은혜는 역사에 남을 거짓말을 만들었고, 외교부는 재판을 걸었구나! 윤머시기 폐하 시절은 줏대없는 멍청이들이 드럽게 많았구나!",False
@dragon-gabstevelim8961,2025-08-18T09:01:45Z,0,MBC미쳤냐?<br>어디서 저 재수없는 면상을 화면에 띄우는거야!<br>저녁 먹어야 하는데….에이 퉷!,False
@김칫,2025-08-18T09:01:43Z,0,주댕이를 꼬매야할 놈들 천지,False
@GUCCI.1977,2025-08-18T09:01:27Z,0,수사하자<br>은헤,False
@고김재규님의명복을빕,2025-08-18T09:00:26Z,0,도대체 어떤 집구석에서 어떻게 키웠길래 거짓말을 저렇게 숨쉬듯 자연스럽게 술술 내뱉을 수 있나?,False
@qpalzmqaz,2025-08-18T08:59:17Z,0,꼭 못난 것들이 (강자)앞에선 헤헤거리고 <br>뒤에선 센척 하느라고 ㅅㄲ가 어쩌구 저쩌구 하더라.<br>졸렬하기 짝이 없더라.,False
@하우-p1x,2025-08-18T08:59:16Z,3,저렇게 뻔뻔하게 거짓말을 할 수 있는 것도 무한 재능이다.,False
@버찌-u7q,2025-08-18T08:58:47Z,0,모가지 돌리는김에 360  돌리고 싶네,False
@tomen55,2025-08-18T08:58:27Z,0,"정말 못된 놈이 무식하기 짝이 없는 소송이였지..., 국민의 귀 까지 통제하려는 놈, 그렇게 평생 빵에서 살아라!!!~",False
@sang07e21,2025-08-18T08:58:19Z,1,입만열면 거짓말이 튀어나오는 쓰레기,False
@흐르는강물처럼-n5m,2025-08-18T08:57:41Z,0,저 잡범 놈 안보고 싶은데..뉴스에자꾸나오네 뺜쮸나 입고 버티는놈,False
@getme7270,2025-08-18T08:57:10Z,0,진짜 미친 ...국격을 떨어뜨린 윤석열 발언 그리고 말도 안되는 소송과 판결 이를 한자들 싹 다 처벌하고 무엇보다 법을  맘대로 이용해서ㅜ언론 탄압하고 소송도 한 윤석열에게 도 처벌과 책임을 물어야 한다고 봅니다 <br>다시는 국가 권력을 이용해 이런일이 없어야 합니다.,False
@양만춘-y1i,2025-08-18T08:57:03Z,0,국민 세금으로 진행한 소송비용 강훈이 한테 구상권 청구해라,False
@오은수-m3l,2025-08-18T08:56:41Z,0,사법부가 한국 민주주의의 방해꾼이 된 사건,False
@anunnkihermaion3619,2025-08-18T08:56:22Z,0,판새 무리도 썩을대로 썩었다~,False
@sang6667,2025-08-18T08:56:21Z,0,동맹을 쉬ㅣ손한건 윤석열,False
@sirlesbe,2025-08-18T08:55:08Z,0,자 이제 누가 방송장악하려고했지 2찍들아?,False
@bjkim-dq2kz,2025-08-18T08:55:00Z,0,아... 그리고 판결 요상하게 한 판사도 책임을 꼭 물어야 합니다.<br>다시는 법 가지고 밥 못벌어 먹게 만들고 지금까지 그 판사가 행한 판결 하나 하나 다 따져봐서 그를 법 앞에 처벌해야 합니다.,False
@박뽕쑤,2025-08-18T08:54:49Z,0,라면도 아니고 날리면이나 껄어처무라 빈신자숙,False
@딸기9,2025-08-18T08:54:31Z,0,판독불가래  판사야 말이냐 똥이냐,False
@드렁큰멧돼지,2025-08-18T08:53:58Z,0,지가 훼손해 놓고 그 훼손을 보도한게 MBC 인데 보도했다고 동맹을 훼손 했다고 고소를 한다고? 이건 무슨 경우냐?ㅋㅋ~ 똥 싸놓고 똥 쌌다고 하니 명예훼손 고소한다고 날뛰는 꼴이네?,False
@마구스99,2025-08-18T08:53:47Z,0,성지호 판사 조만간 나와서 그때 청와대에서 압박을 해왔다 라고 말할수 있을까????,False
@action6140,2025-08-18T08:53:39Z,5,"판사들이 문제다. 다 들리는데, 판단할 수 없다??",False
@슬혜음-c4u,2025-08-18T08:53:32Z,0,이 쉐이는 숨쉬는것도 구라다,False
@ykkk-u6l,2025-08-18T08:53:31Z,0,개비씨는 할줄 아는게 윤통 거니 터는것 밖에 없나.  민주당 재명이 홍보찌라시야. 뭐 신선한거 방송 좀 해봐라. 언론자유라고 떠들더니 고작 하는짓이 정권나팔수나 하고 있으니 개비씨답다,False
@이근열-e7e,2025-08-18T08:53:07Z,0,MBC.   만.  남기고.  모든 언론은. 문 닫아라.,False
@asura3744,2025-08-18T08:52:32Z,2,성지호같은 놈은 더이상 재판정에서 호가호위하게 놔둬서는 안된다. <br>그리고 강훈과 김은혜 이런 나라를 좀먹는 세력들도 탈탈 털어서 다시는 이런일이 반복되지 못하게 해야함.,False
@짱맘-f6u,2025-08-18T08:52:30Z,0,썩은 무리들 반드시 응징이 있기를 천벌을 받을지어다,False
@쿠키-w8g,2025-08-18T08:52:08Z,0,어떻게 하나같이 저런 인간들이 윤씨와김건희 아래에 쫘악 집결했을까,False
@dlems-n8r,2025-08-18T08:51:30Z,0,판결도 웃겨~ 어떻게 결정없는 판결이  있을 수가  있는지~~~  이러니  웃기는  ~~~~~~~,False
@sensor6453,2025-08-18T08:51:18Z,0,진짜 윤아저씨 때문에 우리나라 정치 시스템이 동남아 수준으로 갔다,False
@쿠키-w8g,2025-08-18T08:51:04Z,0,"지금 와서 낱낱이 밝혀지는 저들의 만행을 보니,  진짜 구역질 나는구나.  한미 동맹을 깬 거 지 주둥아리에서 나온 &quot;날리면 쪽팔려서 &quot;이다.",False
@검언에길들여진개돼지,2025-08-18T08:50:44Z,1,갱상 강원도것들  귓구멍에만 날리면으로 들렸겠지 !<br>국짐에선 나라를 팔아 먹자고 해도 냉면을 말아 먹자고 들었다고 우길 갱상 강원도것들이다.,False
@홍첸동이야기,2025-08-18T08:50:40Z,0,저 뻔뻔한 나짝을,False
@Lazy_is,2025-08-18T08:50:28Z,7,강훈 국정홍보비서관- 1969 경북 포항<br>성지호 판사 - 1962 경북 상주<br>이게 과학.,False
@parati4u,2025-08-18T08:50:24Z,0,어휴.... 저런 쑤뤠기를.... 욕이 아깝다.,False
@딸기9,2025-08-18T08:50:10Z,0,쟤는 지얘길 꼭 저렇게 해,False
@복덩이육아일기,2025-08-18T08:49:53Z,0,인과응보 죄값 달게 받으슈,False
@Parkrinha,2025-08-18T08:49:37Z,0,망쪼든나라 그 시간이 다가온다,False
@djfghqwr_21,2025-08-18T08:48:43Z,0,저새끼구라칠때 특유의 화법과 눈깔,False
@바람소리-w4f,2025-08-18T08:48:37Z,0,그당시 고위직에있던 모든사람은 윤과 한패였고 그상황이오면 똑같은짓할것~,False
@캡틴-p8m,2025-08-18T08:48:32Z,0,관련된 외교부 직원 전원 해고 하고 구속 수사 해라,False
@nothingtobdone,2025-08-18T08:48:32Z,0,법조계  검사 판사 모두 수사해서  처벌해야되<br>무슨 짓을해도 처벌받지 않는 권력들,False
@미래소년코난-v6r,2025-08-18T08:48:02Z,0,게늠들 나라세금을 더러운데 쓰고있네...저것들 싸그리 수사해서 구속시켜라~!,False
@임경택-i2s,2025-08-18T08:47:43Z,0,재판잠<br>성지호. 이놈 꼭. 기억해라!,False
@ssk3874,2025-08-18T08:47:38Z,0,조선일보는 사라져야할 반국민 반국가 세력이라고 생각합니다.,False
@jhpark-nv3mz,2025-08-18T08:47:09Z,0,영상이있는대도 저렇게 대놓고 아니라고 할수있다는게 더 대단한듯,False
@정성필-x9m,2025-08-18T08:46:24Z,0,사법부도 문제가 많네요...,False
@lock7942,2025-08-18T08:46:09Z,0,Ai에게맞겨봐라 답나온다,False
@랴니-q4b,2025-08-18T08:44:23Z,0,네가  이때부터    뚜껑 열렸다~~~~~제발  특검 이라도 햇어   관련자  전부   처벌 하라ㅏㅏㅏㅏㅏㅏㅏㅏㅏㅏㅏㅏㅏㅏ11111111118888888888888888,False
@dlems-n8r,2025-08-18T08:44:10Z,0,"자기 스스로가 기억이 안난다 했으면서 여튼 코메디 같은 검찰 정권 이었어, 당사자 주변인들만 충성심이라고 미쳐 날뛰는~~~~~~~지금까지도 무슨 단어인지도 밝히지  않으면서  치매인건가~~???????????????????????????????",False
@웅이웅이아부지,2025-08-18T08:44:08Z,0,입벌구들의 최후ㆍㆍ대대손손 창피하겠네,False
@liberlationwind8424,2025-08-18T08:43:50Z,0,윤빤스목거리,False
@대경무심봉연부동,2025-08-18T08:43:43Z,0,저런 머저리를 찍은 내란당은 절대 저 돼지 보다 어리석어 지리멸렬하는 것이다.,False
@quixoteson3042,2025-08-18T08:43:42Z,0,"이때 벌써 벌거벗은 임금님처럼, 터무니 없이 언로가 마비된 독재 정치, 공포 정치의 신호를 알렸다. 세칭 기레기 언론은 저항 없이 순수히 투항 했고, 저들의 간덩이는 더욱 커져 갔다. 아, 무조건 힘으로 밀어 붙이면 되는구나, 그러다 마침내 국민을 탱크로 밀어 붙이려 한 것.",False
@kdog7777,2025-08-18T08:43:36Z,0,널 가리켜 김정은 보다 더 나쁜 넘. 니가 바로 친일파겸 빨갱이다,False
@Asdfgertrm4bh,2025-08-18T08:43:14Z,0,김은혜 강훈 잊지 않겠습니다.,False
@liberlationwind8424,2025-08-18T08:43:07Z,0,국민을 속여.   국민을 뭐로보고.   지옥가라.,False
@true3170,2025-08-18T08:43:02Z,0,보수는 절대 뽑으면 안 돼 ㅡ,False
@blee5490,2025-08-18T08:42:49Z,0,조선일보 ㅋㅋㅋ,False
@NYChoo,2025-08-18T08:42:44Z,0,구역질난다진심  국가운영을 무슨 조폭집단 운영하듯햇네 아오,False
@cheat1022,2025-08-18T08:42:32Z,0,10서겨리 조동이를 날려야,False
@user-pe4uw2qo3b,2025-08-18T08:42:27Z,0,검찰의힘을 개인권력으로 김건희정부의흑역사,False
@lee-1027,2025-08-18T08:42:11Z,0,중요한건 1심에서 mbc가 진거 아닌가?,False
@유현-z8p,2025-08-18T08:42:01Z,1,윤석열 사람아니라고~  바이든날리면 할때부터 내가 말햇자나 인간 아니라고,False
@jgjt2221,2025-08-18T08:41:50Z,0,역시 조선일보 출신이 또,False
@true3170,2025-08-18T08:41:47Z,0,지 맘대로 안되면 소송? 그게 소송할 일인가? 그냥 실언 한 번 했다 하면 될 걸~하여간 ㅡ,False
@경훈조-r2x,2025-08-18T08:41:20Z,0,내란수괴의행적하나하나가 다 재소사해야한다고본다,False
@lee-1027,2025-08-18T08:40:59Z,0,제발 감옥좀 보내자,False
@김두환-k5i,2025-08-18T08:40:38Z,0,싸가지  졸라  없네   별도   수사해서   구속해라,False
@th9845,2025-08-18T08:40:38Z,0,저거  관련된 관계자들 보청기히나씩 해라,False
@호테-o2y,2025-08-18T08:40:38Z,0,또 조선일봌ㅋㅋㅋㅋㅋㅋ,False
@ClubmanJCW,2025-08-18T08:40:35Z,0,역시 그쪽 지지하는 놈 답게 찌질하고 추잡스러운 행태,False
@꼬물꼬물-z9t,2025-08-18T08:40:24Z,0,성지호 정치판사 똥견,False
@볼빨간라이더,2025-08-18T08:40:22Z,0,윤석열과 국짐당은 그냥 다 감방에 쳐 넣어야 합니다,False
@kckim-z5x,2025-08-18T08:40:12Z,0,윤건희와 그것들의 개를 &#39;바이든&#39;합시다,False
@czl5080,2025-08-18T08:40:12Z,0,윤꼴통 라인  👎👎👎,False
@나는나투다,2025-08-18T08:40:01Z,0,드러운것들,False
@user-inhoan,2025-08-18T08:39:57Z,2,윤셕열 지긋지긋하다.<br>지금도 윤어게인을 외치는 자들도 추하다.,False
@파인애플-d9f,2025-08-18T08:39:09Z,0,잣선일보 빤써결 마누라가 폐간시킨다드만 ㅋㅋㅋ,False
@최정식-i6h,2025-08-18T08:38:43Z,0,미친나라의 날리면 대통외교부,False
@quixtar4uu,2025-08-18T08:38:13Z,0,윤가넘은 미친넘이었다...대통후보로 내세운 국힘도 반성하라 ~~,False
@BBBCCMMM,2025-08-18T08:37:50Z,0,"아오 MBC,",False
@gunawanchandra6254,2025-08-18T08:37:49Z,0,조선일본 기자 출신이 전부 그모양임...,False
@ok-oy6rc,2025-08-18T08:37:45Z,0,사람 새끼가 아닌걸 대통령으로 만들었으니 나라가 제대로 굴러 갔을리가 ....<br>이제라도 저런거 다시 안보게 좀 잘하자 !!,False
@최은석-s1q,2025-08-18T08:37:27Z,0,나쁜놈의 새끼...지 하나 때문에 수많은 사람들이 피해를 보게 만들고...,False
@광화-t8g,2025-08-18T08:36:57Z,1,이런 무도한 멧돼지 정권은 절대로 다시 탄생하면 안 된다.,False
@빈자리-k7z,2025-08-18T08:36:35Z,1,석열이.건희 정권정말로 할말없게 한다...이구 <br>저놈들과 내통자들  절저히 조사 부탁드려요..국힘은 해산이 답이다,False
@정우찬-q3h,2025-08-18T08:36:34Z,0,특검뿐만 아니고 특판도 실시해야 사법부가 바로잡힐 것 같구나<br>이런 인간들이 있기에 나라가 위험에 빠질 수 있는 것이니 꼭 바로잡아야 한다,False
@정철오-l7p,2025-08-18T08:36:24Z,0,저런 인간들은 절대 용서하면 안 된다.,False
@대발이-f7x,2025-08-18T08:35:58Z,0,김은혜도 수산받아라,False
@arewe-w9c,2025-08-18T08:35:52Z,0,판결한 판사에 강력한 중징계가 필요함... 그리고 여기도 조선일보가 나오네 ㅋㅋㅋ,False
@희나리-r7w,2025-08-18T08:35:43Z,0,이래서 사법 카르텔을 무너 트려야 한다고 생각합니다,False
@5월의데이지,2025-08-18T08:35:23Z,0,꼴도 목소리도 보고 듣기 싫다 외피 인간,False
@jpj3596,2025-08-18T08:35:00Z,0,외교부 장관이었던<br>윤버러지부터,False
@트레요캐미다로리샤바,2025-08-18T08:34:33Z,0,이건진짜ㅋㅋㅋㅋㅋㅋㅋㅋ뭔 심슨 에피소드같음,False
@단군할배,2025-08-18T08:34:16Z,0,"내란의 자식,,,,성지호,,,,,<br>영원히 박제시켜,,자식들에게 물려주라,,",False
@종성이-r1f,2025-08-18T08:34:03Z,0,야 조국이 한태 한거 못봄? 이재명은? 엠비씨보다 힘이 없어서 당함? 그냥 그짐승들이 원래 딱 그런개들이라 그런거임 보이는것만해도 산을 이루는대 안보이게 죽이려한 짓거리는 또 얼마나되려나,False
@달무리-j5l,2025-08-18T08:33:55Z,0,건들건들 그래서 구속되었냐<br>개잡범,False
@hosangchoi8420,2025-08-18T08:31:38Z,0,"언론탄압에 정부가 총동원되어 혈세낭비 해댄거 누가 책임져야 하나, 소송비 1원이라도 업무시간 1분이라도 문서 1장이라도 써댄거 다 구상청구해야 한다",False
@kikiro3333,2025-08-18T08:31:36Z,0,김은혜는 도지사 후보로 나왔을 때 선거법 위반했는데 수사는 왜 안하냐?<br>왜 사법부는 국힘에게만 특혜를 주나?,False
@Jpark-z6i,2025-08-18T08:31:13Z,0,저 도리도리 대가리좀,False
@얼씨구-m7g,2025-08-18T08:30:50Z,0,김은혜부터 털어야,False
@yeoilyun3986,2025-08-18T08:30:25Z,0,성지호 귀가 먹었어요. 그런 사람이 판사를 하네. 그만둬야 하지 않아,False
@schyeun,2025-08-18T08:29:42Z,1,김은혜는 고막이 터졌나보지 ㅋㅋ,False
@김철균,2025-08-18T08:29:20Z,0,윤도리는 특별법을 만들어서라도 대한민국 대통령이었다는 이력까지  없애야한다 저런놈한테 국민세금이  저눔연금이도는것은 불합리하다,False
@좋은생각-e4i,2025-08-18T08:29:03Z,0,"우기고, 거짓말하고, 덮어씌우고, 조작하고,  회유하고, 삿대질하고, 욕설하고, 겁박하고, 폭탄주나 마시고, 무지하고. 이런 인간도 오천 년의 역사에서 드물 것.",False
@CH-rh5vb,2025-08-18T08:28:58Z,0,"자, 싹 다 제대로 털어 봅시다. 뭐 제대로 법대로만 해도 다 날려버릴 수 있지 않습니까? 조국 털듯이만 다 털어보죠?",False
@김근우-f7y,2025-08-18T08:28:39Z,0,강훈 같은 놈이 바로 일제시대 일본을 위해 앞장선 인간과 같은 부류다. 나는 그렇게 생각한다.,False
@hyejongsong,2025-08-18T08:28:37Z,0,"윤썩열과 김거니 부부가 온 나라를 망쳐놨음, 밑에는 지같은 놈들만 죄다 데려왔고 그러니 나라가 제대로 돌아가겠어?",False
@sokang6,2025-08-18T08:28:20Z,0,재판에서 증거와 양심을 개무시하고 정치검사와 한몸이 돼 판결하는 정치판사가 더 나쁜 것. 처벌 해야 함.,False
@butter_almond,2025-08-18T08:28:04Z,0,"세금을 줬같이 쓴 외교부, 대통령실 거기 동조한 판검새 변호새 새ㄲ들 다 잡아들여라. 나라가 정말 줬같이 돌아갔었네 진짜",False
@박정숙-v3q,2025-08-18T08:27:50Z,0,야 헛소리 하지마 바이든이지어떻게 날리면이야 똑같은 멍청이,False
@gyunamjung4534,2025-08-18T08:27:50Z,0,소송비<br>강훈이한테 받아라,False
@두두다다-f6g,2025-08-18T08:27:42Z,0,3년동안 나라시스템을 아주 조져놨네 ㅋㅋㅋ,False
@이용우-q8b,2025-08-18T08:27:41Z,0,아직 MBC방송국이 살아 있나? 북한 방송국이 왜 남한에서 방송하지.,False
@dlvkfks23,2025-08-18T08:27:28Z,0,다 처벌 받아야지. 하기 싫었다고 해서 외교부의 잘못이 사라지지 않는다. 그리고 저 판결한 판사 ㅋㅋㅋ 양심은 애초에 없었지?! 사법부 반드시 개혁해야 한다!,False
@서성일-u1i,2025-08-18T08:26:55Z,0,권력의 개 노릇 하면서 나라를 말아먹는 놈들을 반드시 찾아내 처벌해야 한다.,False
@감생이-t1k,2025-08-18T08:26:27Z,0,욕도 아까운 인물,False
@BigSecretFriend,2025-08-18T08:26:24Z,0,저 고개도 똑바로 못들고 말할때마다 고개가 흔들흔들 그러니 머리에 든게 있나<br>얼릉재판이나제대로 해라 내란수괴야,False
@그래그래-y6m,2025-08-18T08:25:56Z,0,10새끼가 주댕이만 움찔하면 구라여.,False
@순희이-z8k,2025-08-18T08:25:16Z,1,모지리가 지 얘기를 하고있네.,False
@bbrain-be,2025-08-18T08:25:05Z,1,정말 뻔뻔한 인간들이다. 누가 미친인간들인거냐? 국힘 저것들도 한통속이다,False
@bd-mz8xc,2025-08-18T08:24:59Z,1,기억안나 대그빡은 머하러 달고 다니냐 시바견시키,False
@이치더킬러,2025-08-18T08:23:54Z,4,저 황당한 판결의 재판장 이름이 성지호 였군. 리멤버.,False
@jdd1102,2025-08-18T08:23:50Z,1,맷돼지 사형..<br>조선기레기 폐간..,False
@남동일-u1j,2025-08-18T08:23:25Z,1,형편없는 국암당과 썪열이는 강력한 법심판을 받아라,False
@언제나행복-k7u,2025-08-18T08:23:10Z,4,거짓말 하는겨...너무 지겹다...!!! 아주 지긋~  지긋~ 해~!!!!!,False
@tonkeyyoung8872,2025-08-18T08:23:09Z,1,게엄이 더 국민을 파탄에 빠뜨렸다,False
@paek7312,2025-08-18T08:23:00Z,1,석렬아 지금 니네편애들이 동맹을 훼손하고 있다 머라 해주라,False
@bckong8496,2025-08-18T08:22:58Z,1,고개좀 엥간히 저어라  정신없다,False
@Chandra-o1z,2025-08-18T08:22:18Z,1,"여기서부터 이미 독재의 서막, 혼빠진 꼴로 &#39;날리면&#39; 날리는 꼴이라니",False
@jns1696,2025-08-18T08:22:08Z,1,하여간 이상한놈들<br>조선인보놈들<br>윤석렬똘마니들<br>강훈같은인간들,False
@euna4339,2025-08-18T08:21:31Z,1,에레이 돌i,False
@이슬-m1i,2025-08-18T08:21:09Z,1,지금까지 윤건희가 대통령이였으면. . .<br>아찔하다,False
@송림-f2m,2025-08-18T08:21:08Z,1,본인이 한말도 제대로 말못하는 대통령,False
@산골지기-kr,2025-08-18T08:20:57Z,85,특검해야한다,False
@WANG8668,2025-08-18T08:20:53Z,1,윤석열 이십세기 과거 발언과 행동보면 다 지 잘못을 남에게 전가하고 무식하게 칼을 휘두른다. 아주 비열하고 비겁한 놈이 아닐 수 없다.,False
@danbipapa,2025-08-18T08:20:41Z,7,"16시간동안  짜낸게 고작 날리면이었어,",False
@신승아-m6h,2025-08-18T08:20:37Z,1,관계자  싹다 처벌하자,False
@LeeiSangDae,2025-08-18T08:19:51Z,1,신문도 아닌 조선잡지 꼭 폐간,False
@sj2589,2025-08-18T08:19:50Z,1,이딴 놈들이 판사랍시고 자리를 꿰차고 앉아서 지 입맛대로 판결을 내리는데<br>제재할 수단이 없다는게 말이 안 됨.<br>거대 언론사인  MBC조차 이렇게 당하는데 힘 없는 소시민들은 검새랑 판새에게 <br>얼마나 당했을까..,False
@ww9724,2025-08-18T08:19:33Z,2,"내란 쿠테타 범죄자와 관련자 전원을 사형 안 시키고, 천수를 누리게 하니 반성 없이 계속 요구가 많지.<br>내란 쿠테타가 성공하면 대대손손 잘 먹고 살고, 실패해도 편안하게 생을 마감하니 손해볼게 없는 언제나 노나는 장사.<br>선진국 미국은 수십년이 지나도 내란범과 관련자 전원을 사형으로 처벌한다. 후진국은 내란 재발을 위해 절대 사형집행 안하지.",False
@ryanlee9100,2025-08-18T08:18:59Z,2,조선일보 Ge-Se-Ki.....역시 조선일보는 이번 정권때 폐간 조치하고 조선일보 족벌 경영자 새끼들 슈킹한 돈 전부 국고 환수 조치 해야 한다 !!!!,False
@밤돌샘,2025-08-18T08:18:42Z,1,"이번 일로 서울대학교 법대, 검찰, 판사, 고위 공무원, <br>이런 이들은 모두 오래 앉아 외우고 답만 잘 쓰는 사람들로 <br>철학도 없고 신념도 없고 애국심도 없고 국민까지도 아주 우습게 여긴다고 밝혀졌다.",False
@dungdale,2025-08-18T08:18:13Z,2,됐고 부당한 언론사 때리기에 참여한 모든 공무원 직위박탈하라,False
@영권이-l7u,2025-08-18T08:18:02Z,1,국격을   망쳐놓은   윤석열,False
@SwanjungPark,2025-08-18T08:17:49Z,1,윤 뚱 한마디에 모든 시스템이 무너짐..<br>그 중 최고 책임은 판사...,False
@石江-d1k,2025-08-18T08:16:50Z,1,이런 놈들과 국짐을 아직도 지지하고. 해체 외엔 답이 없다.,False
@ockhamsrazor-v,2025-08-18T08:16:27Z,1,조선일보스러운 조선일보 출신,False
@Lee_Kay_,2025-08-18T08:16:24Z,1,이런 쓸데없는 짓만 하니 해야 할 일을 할 시간이 하나도 없었지. 제대로 일을 할 수도 없었지. 오로지 내가 미워하는 사람이나 단체에 복수하는 것 외엔 다른거 아무것도 할줄 아는거 없는 쓸모라곤 하나도 없는 인간이 대통령을 했었음. 아주 세상에 없는 악성 중의 악성 나르시시스트임. 인간군상 여러 형태중 최악 중의 최악. 절대로 만나면 안되는데 의외로 한국사회에선 곳곳에 자주 보임. 대처법을 배워야함.,False
@leejehak2480,2025-08-18T08:16:22Z,1,"지가 실수해놓고, 바이든 만나서 깨갱하고, 대신에 개목걸이 받아왔지?",False
@yunkyong9163,2025-08-18T08:16:01Z,1,미국은 한국을 좋아합니다. <br>사실 말잘듣는 똘마니가 아닌가요 ?<br>윤석열의 개소리 웃어넘기죠. 왜 말잘듣는 개정도로 생각할테니까.<br>자기들끼리는 뭐라고 얘기할까요 ???,False
@가로수-x2g,2025-08-18T08:15:52Z,1,죽일넘들~~,False
@선봉이-f9h,2025-08-18T08:15:45Z,1,아무리 듣고또듣고 들어도  이새끼들이 승인  바이든이 쪽팔려어라고들리는데  듣기전에 건강검진결과청력정상으로나왔음,False
@gold9874,2025-08-18T08:15:07Z,0,자국의 대통령이 타국의 대통령 욕했다고 <br>사실 확인도 잘 안되었고 뜻도 해석이 안되는 말을 엮어 속보로 날리고 <br>그 타국에 확인해달라고 이간질 하고 신나서 헤헤거린 엿같은 방송사. <br>나라고 뭐고 없어. 이것들은.,False
@namoo-y5d,2025-08-18T08:15:04Z,122,진짜 나쁜놈들이야,False
@hyunsukim699,2025-08-18T08:15:01Z,1,강훈에게 소송해라,False
@leejehak2480,2025-08-18T08:14:56Z,1,뻔뻔한 멧돼지....,False
@와이프-y4f,2025-08-18T08:14:47Z,1,개조선출신들은 하나같이<br>저모양인지~~,False
@좋은날-s3m,2025-08-18T08:14:33Z,1,조선일보는 항상 민주주의에 역행에 왔던 언론사 아닌가? 이참에 씨를 말려야 하지 않겠나!,False
