author,published_at,like_count,text,is_reply
@삐끼객기-p5f,2025-08-18T07:14:47Z,0,"김은혜 남편이 그 유명한 극우꼴통 집합소인 법무법인 김앤장이니 아무도 손을 못댈 것이다. 판사출신에다가 남편도 판사인 나경원 재판도 8년이상 질질 끌고 있는 것처럼...이참에 나경원 특검, 권성동 특검도 같이 해보자.",False
@꿈푸,2025-08-18T07:14:28Z,0,강훈아 너도 잘가라~ㅋㅋㅋ,False
@user-korea-n6l,2025-08-18T07:14:24Z,0,서부지법에 저런 판사가 있으니 광후니까 믿고 처들어가지.. 자업 자득이네. ㅎㅎ,False
@강영석강영석,2025-08-18T07:14:02Z,0,진상은 니가 진상이다 너는 그냥 뒈질때까지 감옥에 있어,False
@사랑-l4s,2025-08-18T07:13:10Z,1,인간이라 볼수없다.,False
@지존-d5o,2025-08-18T07:13:03Z,0,저런 바보놈을 대통령이라고 뽑았냐? 2찍들아!<br>정신좀 차려서 현실을 직시해라.,False
@vvipeerff,2025-08-18T07:12:35Z,0,찌질하다. 양아치,False
@꿈푸,2025-08-18T07:12:19Z,0,진짜 뻔뻔한 놈이다 넌 정말...ㅋㅋㅋ,False
@0525mjs,2025-08-18T07:12:04Z,0,거짓말 쟁이들과 권력의 시녀들이 판치는구나. 부끄럽지 않나.,False
@MinhHau45,2025-08-18T07:11:57Z,0,성지호 판사 시발럼,False
@sweethome9394,2025-08-18T07:11:36Z,0,아 ㅆㅂ 도리도리 죽탱이 마렵네,False
@user_RnDwoRDs,2025-08-18T07:11:18Z,0,이게 어디 자유민주주의 국가에서 일어날 일이냐... 진짜 후진국 맛 찐하다 ㅋㅋㅋ,False
@범-y5z,2025-08-18T07:11:16Z,0,거의 나라를 새로 세우는 정도의  개혁이  없으면 내란 잔당  척결은  불가능하겠구나,False
@cranenew,2025-08-18T07:11:02Z,0,날리면 잘한다고 성남 시민들은 국회의원으로 뽑아주는데 무슨 일인들 못하랴.,False
@그남자-t4q,2025-08-18T07:11:01Z,0,모두 수사대상이네<br>용서가 안되는  애들이 너무 많다,False
@아키팍,2025-08-18T07:10:54Z,0,자신을 중도라고 포장하고 있는 바보들이 정신 차리지 않는 한 제2의 윤석열은 언제든지 또 만들어 진다.,False
@bigbabarian7449,2025-08-18T07:10:53Z,0,바이든이 얼굴도 안보고 악수하고 개무시하고 왕따 시킨게 참모들에게 창피한 나머지<br>윤빤스 이놈이 참모들 앞에서 바이든 흉보고 쎈척 하려고 내뱉은 말 바이든 날리면<br>들통나니까 미국 동맹 어쩌구 저쩌구 하며 미국 팔이로 MBC 탄압,False
@블루스카이-e3e,2025-08-18T07:10:48Z,0,"김은혜가 뭔 죄겠어요.<br>재수 없게, <br>되어서는 안 될 석열이가 대통령이 돼서<br>어쩔 수 없이 홍보수석에 앉혀 놓으니 <br>꼭두각시 노릇을 할 수밖에 없었겠지요. <br>잔뜩 쫄아가지고 말 한 마디 못하는...",False
@John-vg6yg,2025-08-18T07:10:45Z,0,조선일보도 똑샅은 장법으로 폐간시티자,False
@justicenfairness8424,2025-08-18T07:10:20Z,0,지가 훼손해놓고..어찌 저리 뻔뻔한건지,False
@박정우-e1k,2025-08-18T07:10:10Z,0,"씨벌롬, 살만하지 ??",False
@명랑-h6b,2025-08-18T07:10:02Z,0,썩열이는 지 입으로 한 말을 어찌 저리 양말 뒤집듯 뒤집을까?,False
@veronica-vu5qx,2025-08-18T07:10:02Z,0,주둥이만 열면 거짓말 지가 잘못해놓고 동맹사이 훼손 ㅋㅋㅋ 지가해늏고 누굴탓해 진짜 저런게 대통이라고 있었으니 나라망조였다,False
@DR.Kmaster,2025-08-18T07:09:51Z,0,"당시에 윤의 강압이든 뭐든 간에 동조했고, 이익 챙겼으면 공범입니다.",False
@백아절현-f2d,2025-08-18T07:09:45Z,0,대가리가 D급이니 밑에놈들도 다 그수준이지머~~<br>유시민말이 소름끼치게 정확함,False
@jiminlee9045,2025-08-18T07:09:33Z,0,바이든 날리면 부터 알아봤지.그런작자가 한나라에 대통령이 였으니 계염까지 가서 나라를 혼란에 빠트린거지.윤건희 최대 사형.,False
@JohnWick_진피약편,2025-08-18T07:09:15Z,0,지가 잘못해 놓고 상대방에게 온갖 죄를 덮어 씌워 기소하는 악마쉐키들,False
@cliftjjw,2025-08-18T07:09:10Z,0,판사도 이제 빵에 가야지,False
@송기호-n7z,2025-08-18T07:09:09Z,0,지금봐도 망청한 짓거리,False
@국태호-m8r,2025-08-18T07:09:05Z,53,강훈. 김은혜를 반드시 처벌 해야만 대한민국이 선진국으로 갈 수 있다.,False
@user-kl7fx4pn9o,2025-08-18T07:09:01Z,0,성!!! 지!!! 호!!! 판사!!!!!!!!!!!,False
@user-im5cm4jj1q,2025-08-18T07:08:59Z,0,대통령실도 불법 행정처분이 잘못된 걸 아니까 무고죄를 피할려고 아무 상관없는 외교부에게 소송하라고 시킨거지. ㅋㅋ,False
@197One,2025-08-18T07:08:58Z,1,정부 및 정치권이 잘못된 고소를 하면 재판부가 제대로 판결을 해야 하는데 정권의 재판부마저 내란 정부의 하수인 노릇을 하니까 모든 재판에 신뢰가 떨어지는 거야. 당장 법원 및 판사 새끼들에 대한 처벌 법을 반드시 만들어야 한다.,False
@전명주-v7v,2025-08-18T07:08:54Z,0,김은혜 구속해라,False
@예측불가-j2f,2025-08-18T07:08:52Z,0,사이코   도리도리    콜걸 남편,False
@진상황,2025-08-18T07:08:48Z,0,짝어 누르고 날리면으로 둔갑 시키면  ~  승리감에 희열을 느끼는 정신병자 ~,False
@nameno1662,2025-08-18T07:08:42Z,0,금융치료필요함 특히 김은혜,False
@oks1975,2025-08-18T07:08:37Z,0,최악의 대통령,False
@오라-f2n,2025-08-18T07:08:36Z,0,대놓고 사기치던 자! 윤석열,False
@나노유-c9p,2025-08-18T07:08:33Z,0,윤 써글과 줄리가 싸 놓은 똥 2찍 새이들이 치워야지 나라 개 작살 내놓고  깐빵에 있으니 인생 새옹지마,False
@유영찬-m8n,2025-08-18T07:08:32Z,0,저런 놈들을 지금이라도 응징해야 한다.........<br>직권남용이 별건가 ???,False
@고블린-m7h,2025-08-18T07:08:00Z,0,너랑 너 마누나가 젤 위험해,False
@pantomime7669,2025-08-18T07:07:55Z,0,도리 도리 안 봐서 속이 시원했는데 오늘 또 봐서 속이 뒤집어지네.,False
@fghygd-r1r,2025-08-18T07:07:52Z,17,아무짝에도 쓸모없는,False
@jamestown5354,2025-08-18T07:07:51Z,0,김은혜 재산신고 누락도 꼭 조사해 주세요 성지호 판사도 꼭 기억합시다,False
@seobang18wang66,2025-08-18T07:07:47Z,0,대구내란당 역시 역적질에 최적화된 종자들이다.,False
@방철진-r4x,2025-08-18T07:07:41Z,0,개소리 원인제공은  니가  했는데  왜  사실 보도를 한  MBC를  탄압했지  ㅋ  ㅋ   ㅋ,False
@아이필-c1n,2025-08-18T07:07:19Z,0,천벌을 받을끼다,False
@cliftjjw,2025-08-18T07:07:07Z,0,빵에 가야지,False
@s.gwannabe236,2025-08-18T07:07:07Z,0,"저런게 3년간 대통령이였다,쪽팔린다",False
@신현선-b9b,2025-08-18T07:06:45Z,22,천하에 나쁜넘들...,False
@rnfkekd,2025-08-18T07:06:34Z,0,정권잡고  국정기관을 지가  싼똥 치우느라 국정은 등안시하게 만들고 바른소리 하는 사람들 죄없는 사람들 시비걸고  잡아 족치는데 골몰한 천하의 개호로자식.윤두머리.,False
@SciAtist,2025-08-18T07:06:20Z,0,석열쩌둥 :  저 언론은 해로운 언론이다,False
@showreel77,2025-08-18T07:06:17Z,0,"이렇게까지 다 까발려지다니,<br>보는 내가 다 한심하고 창피하다<br>이기지도 못할 싸움에 <br>판은 다 벌여놓고 쯧~<br><br>완벽하고 처절한 패배의 좋은 본보기가 될 정권,",False
@chico3574,2025-08-18T07:06:15Z,0,본보기로 김은혜 박진 민형사 책임을 묻으십다,False
@gkb6772,2025-08-18T07:06:14Z,0,mbc 고생 많았다,False
@rsamg3720,2025-08-18T07:06:05Z,1,니가 대한민국의 가장큰 위협이었다,False
@이쁘요-n1i,2025-08-18T07:06:01Z,0,입만열면<br>거짓말<br>내란수괴 <br>내란우두머리<br>한심한 인간들<br>이렇게해도<br>옹호해주는<br>인간들은<br>대한민국 <br>사람이 아닌듯,False
@바람-q6j,2025-08-18T07:05:59Z,0,프라이팬위의 윤석열.<br>하여간 뭘 상상하던 그 이상이다.,False
@hoo4138,2025-08-18T07:05:45Z,0,ㅁㅊㄴ,False
@amurtigersurf3874,2025-08-18T07:05:28Z,0,이 쓰레기들을 몰라보는 인간들은 판단 기준이 뭘까,False
@dkfmaekdnstnv,2025-08-18T07:05:18Z,0,"본인이 비속어 쓴걸 감추려 언론사를 말살하려벌인 윤석렬! 정말 검사시절 억울한 사람들 얼마나 많이 족쳐서 잡아 넣었을까 까지 의심되는 정말 끔찍한자란걸 사람 됨됨이는 잘못했을때 사과하고 반성하고 성찰하는 모습을 보일때 용서도 되는데 윤석렬을은 지금껏 국민에게 사죄도 안해 반성은 더더 안해, 본인이 뭘 잘못했는지도 모르는 아주 무지한 인간, 자기를 맹목적으로 추종하는 세력들한테 세력결집 시키려 행동만 하고 정말 감방에서 제대로 자기 성찰하고 나와야 되는 사람이라 생각됨. 원칙을 주장하며 사람에게 충성안한다는 그 말로 전국민을 속인자!!",False
@태원정-f3u,2025-08-18T07:05:14Z,0,쓰레기네 쓰레기,False
@salomej9948쉼터,2025-08-18T07:04:54Z,0,왜 아예 바이든으로 들린다고 한 국민들 전체 상태로 소송을 하지?,False
@newtattoomr.8547,2025-08-18T07:04:52Z,0,해외순방만 나가면 멍어리가 한마디 던진게  &quot;날리면&quot; 이라고 아이고<br>술과 만찬 생각만<br>마눌이는 졸거나 소핑 생각만 <br>뱌벌 한쌍,False
@young5844,2025-08-18T07:04:51Z,0,썩열아 국민을 빠뜨리놓은것은 니가 그래잔아  나라를 다망치놓은것  모조리 구속해라,False
@사막모래바람,2025-08-18T07:04:46Z,0,"잘못을 저지른 게 한두 개여야 말이지. 다 정리하는 데 상당한 시간이 걸릴 것이다.<br>연루된 인간들에게 책임을 꼭 물어야 할 것이다. 그래야 다음에 그런 사람이 덜 보일 것이다.<br>돌격대로 김은혜가 보였는데, 그저 돌격대가 아니라 여러 가지 수혜를 입었으니 그 책임 또한 크다.",False
@진달래-r3o,2025-08-18T07:04:38Z,1,"아휴 정말 저런걸 대통령이라고 빨아주던 기레기들, 대변인, 의원 다 뭐하는지  이런 관계자들 싹 다 정리해서 공개하자",False
@이상규-y8b,2025-08-18T07:04:09Z,0,어휴....진상.... 어디서 저런걸 인간이라고 낳아서 키웠을까 ...<br>부모몫이 60프로다,False
@windcow2006,2025-08-18T07:03:48Z,0,저 놈은 평생 감옥에서 후회하고 후회하도록 만들어야 한다,False
@권구현-s9v,2025-08-18T07:03:39Z,0,판사이름 언론에서 전국민에게 한<br>1주일 공개하라,False
@남궁량-t2t,2025-08-18T07:03:36Z,0,저런것이 대통령이라고 나라를 통제 했으니 나라가 잘될수가 있었나?,False
@ShouRi_KR,2025-08-18T07:03:17Z,198,성지호 판사 이런 사람은 처벌 안받나?,False
@RICHman-h8b,2025-08-18T07:03:16Z,1,사형이 답이다,False
@dueobjin1592,2025-08-18T07:03:08Z,0,윤정권의 MBC 한테 했던거 잘봤다.<br>문제 없어보이는 보도도 저렇게 탄압했던거 같은데...   <br>현정부도 조선 같은 쓰레기들 한테 잘 대응해 보시길...,False
@ihateradiation,2025-08-18T07:02:55Z,0,"김은혜, 당신 인생에 &quot;날리면&quot;은 평생 따라다닐 거다.",False
@터미널포터맨,2025-08-18T07:02:52Z,0,"자기가 해놓고 그냥생을 까고<br>있는 저런나쁜넘이 ... 국가의수장<br>이고 그밑에 아주 폐급 간신쉐이가<br>있었네... 저짓거리이지 국정이 잘돌아<br>가겠나...? 저자들은 나라를 말아먹고<br>이권개입이나하고...  아마 그랬을것같다!<br>정말국민을  맹물로 견 돈으로 본넘들<br>이것도,이슈화시켜서  수사하자! 직권남용<br>언론탄압 ...",False
@김현-p3v,2025-08-18T07:02:43Z,0,대통령실   조선일보출신들이 나라망치는데 앞장섰구만~~~~~,False
@newwhite,2025-08-18T07:02:36Z,1,성지호 판사 웃기는 놈이네..,False
@권구현-s9v,2025-08-18T07:02:31Z,0,진짜 부끄러웠다<br>판사가 언론에 언도한것보면 판사란 인간들  진짜 불필요하고<br>정의감은 새우 ×만큼도 없다<br>세상에 사법부가 저걸 저따위로<br>판결하나,False
@모모-o9u,2025-08-18T07:02:29Z,0,야...저 재판관 진짜 대단하다... 양심이 없으면 상식이라도 있던가.ㅈ,False
@beeniijoo7372,2025-08-18T07:02:19Z,0,도대체 제정신이 박힌 인간이 하나도 없네,False
@brahma-o8h,2025-08-18T07:02:14Z,0,권성동 교도소에서 사는 거 보고싶다.,False
@hahaha-d7u5y,2025-08-18T07:02:01Z,0,싸이코페스네 거짓말을 아주 눈하나 깜빡안하고 하네,False
@공산사람,2025-08-18T07:01:57Z,1,재판부도 더럽고 추잡다,False
@ys6234,2025-08-18T07:01:55Z,0,저자식. 정말 뻔뻔하다,False
@choi5032,2025-08-18T07:01:49Z,0,저 멍청한 기관 관련자들도 전부 처벌해야합니다. 반드시.,False
@ym-rw2hk,2025-08-18T07:01:32Z,0,MBC도 꼭 윤석렬과 똘마니들한테 소송 걸어서 피해보상 받으시기 바랍니다,False
@산검둥,2025-08-18T07:01:31Z,0,계엄때린게 진짜 신의한수였다<br>그일로 5년못채운게 다행이면서도 참...,False
@Haitch-u6c,2025-08-18T07:01:30Z,1,"길길이 ... , 군대 안갔다와서 그렇지 화무 십일홍 입니다.",False
@jqkh1234,2025-08-18T07:01:24Z,0,윤통 바이든 부정선거까지 이미알고있었네 그저 goat,False
@Infinity-korea,2025-08-18T07:01:09Z,0,요약 : 역시 2찍은 정신병자들이라고 생각하면 이해가됌.,False
@텔로미어-k5u,2025-08-18T07:00:50Z,1,나쁜인간 내란패거리들 내란동조범들 정치검사 정치판사 매국노들 멸족하리 하늘의뜻,False
@폴레토,2025-08-18T07:00:37Z,1,적반하장도 유분수지. <br><br>대단한 입벌구 아니냐?,False
@햇님-p1s,2025-08-18T07:00:34Z,0,mbc는 관련된  미친 것들 모두 고발하고 배상 청구해라.,False
@gck1975,2025-08-18T07:00:29Z,0,"저런 것도 사람이라고, 개나 지가 왜 짖어 대는지 모르고 그저 짖어 대는데, 저놈은 지가 짖어 대는 소리가 뭔 소리인 줄도 모르고 짖어 댈 뿐..",False
@malibu4453,2025-08-18T07:00:15Z,0,썩열이 양아치xx  빵에서  뻘뻘  땀 흘리는기  눈에 선함.,False
@홍길동-d6b7t,2025-08-18T07:00:12Z,0,좆선은 반미대통령이라 보도했으니폐간이답이네,False
@najaepo,2025-08-18T06:59:59Z,0,죄에 따른 벌은 왜 필요한가? 다음에 그런 놈들이 덜 나오게 하려는 것이다. 이미 발생 한것이니 적당히 넘어가자고? 그게 지금 한국사회 최대의 문제다.,False
@싹다-kill,2025-08-18T06:59:51Z,0,사악하고 추악한 조작에도 역시 개국짐의 개짓거리가 전부였습니다. 이제 정권은 바꿨고 사실을 알고 있으니 관련자들 엄히 처단하는 일만 남았습니다.,False
@정혜란-o6q,2025-08-18T06:59:28Z,0,저리 뻔뻔할수가 있나?  인간인데~~  인간이  저렇게 뻔뻔해지나?,False
@hyewonm6961,2025-08-18T06:59:22Z,0,입만열면거짓말<br>전국민 듣기평가로 스트레스주고<br>대통령이라는게 외국정상들 기자들이 널린곳에서 속어 비어나 쓰고있으니.<br>동네 이장도 그렇게안한다,False
@brianlee3380,2025-08-18T06:59:18Z,0,수준 낮고 국격 떨어지는 문제를 일으킨건  똥싼바지인데 피해는 MBC가 뒤집어 썼다...이런 놈이 대통령이었다는건 대한민국의 수치임,False
@kenneth-b7d,2025-08-18T06:59:10Z,0,저런 쓰레기가 대통령이었다는게 이나라의 수치다. 감방에서 평생 못 나오게 해야한다,False
@jungjaelim9993,2025-08-18T06:58:46Z,0,&quot;사법개혁&quot; 및 &quot;사법카르텔&quot; 반드시 개혁해야 한다.<br>🎉🎉🎉 😊😊😊,False
@하루살이-e9m,2025-08-18T06:58:37Z,1,저런 맷돼지가 인간세상에 내려와 인간세상을 어집렵했으니 잡아먹히는 것이 당연하다.,False
@공산사람,2025-08-18T06:58:33Z,0,저런 놈이 대통이었다니!,False
@심심한하루다,2025-08-18T06:58:22Z,0,수준이하의 인간들 반드시 응분의 죄값을 받게해야 한다,False
@ss-sy8jo,2025-08-18T06:58:18Z,33,법원 음성감정 결과부터 다시 조사해야함 저게 판독불가 일수가 없음,False
@joungbumpark2223,2025-08-18T06:58:18Z,288,저런 판사는 자격없어 <br>대한민국에서 가장 검찰보다더 더나쁜  양심없는 판사다.,False
@내고향-o7p,2025-08-18T12:26:04Z,2,퇴출이 답,True
@TqTkorea,2025-08-18T06:58:01Z,0,사법부 판사들이 개판. ㅋ,False
@SkynetStart,2025-08-18T06:57:56Z,0,MBC가 나라를 살린거다. 2찍은 정신병이다,False
@나라사랑-q8j,2025-08-18T06:57:52Z,1,쿠데타로 나라와 국민을 엄청난 위험에 빠뜨린 인간이 적반하장도 유분수지. 반드시 사형!!,False
@지랄도풍년-e4h,2025-08-18T06:57:44Z,0,대한민국 모든 2찍 국민들에게 듣기시험이 필요한이유ㅋㅋㅋ,False
@raykim1083,2025-08-18T06:57:29Z,0,길길이 날뛰어.. ㅎㅎ.. <br>뭐가 뛰니까 뭐도 따라 뛰는 꼴이네..<br>모가지 길게 빼고 칼 받을 준비나 해라..,False
@axionbuster,2025-08-18T06:57:20Z,1,외국 정치에 간섭하는 무례한 발언을 한 거. 그냥 사과하면 됐지. 에이그. 나이가 몇이야. 15이야 65야 뭐야.,False
@반왕-d8w,2025-08-18T06:57:19Z,0,저런자가 언론인 이었다니 아니 계란판재료 판매종사자 였구나,False
@KK용,2025-08-18T06:57:09Z,0,이번 사건 전부 특판으로  해라,False
@user-nj2fd7yk7m,2025-08-18T06:56:50Z,0,"그냥 빨리 전기의자에 앉히자. 왜 굳이 저 얼굴, 목소리, 소식을 들어야하냐?",False
@宇亨宇,2025-08-18T06:56:36Z,26,전국민 스트레스 피해배상 소송 들어갑시다.<br>저것들은 철저하게 금융치료가 필요함.,False
@saintmichel4089,2025-08-18T06:56:18Z,0,판사넘이 개웃기네요...아휴...사법부는 정말 답이 없음.,False
@ixtli9510,2025-08-18T06:56:15Z,0,마치 독재국가인 북한같네요,False
@카리스마-r1o,2025-08-18T06:55:51Z,0,윤거니 폭탄!! 여기 저기 z나 많네,False
@운칠기삼-m3j,2025-08-18T06:55:45Z,24,오해의 소지가 있는 발언이 경솔했다 그런 취지는 아니었다 <br>이 한마디면 됬을건데 왜 저리 난리를 쳤던거지,False
@원칙사수,2025-08-18T06:55:33Z,1,"정신나간 판사 누구냐고,,,미친 재임용이 문제가 아니라 판사 탄핵해야지,,순 엉터라같은것들",False
@minsooseol4212,2025-08-18T06:55:22Z,1,어찌 거짓말을 저리 뻔뻔하게 할수잇을까 윤쩍벌 그 수하들이 햇던 짓거리 보면 정말 치가 떨린다,False
@tkdgkr5661,2025-08-18T06:55:21Z,1,"철처하게 조사해서 반드시 바로잡아야합니다.<br>총동원되었든 관계기관,관계자들 책임져야할일이 조사해서 나오면 엄벌해야 합니다.",False
@charlesju2993,2025-08-18T06:55:21Z,1,바이든한테 쪽팔림 당하고 체면이 안 서니까 부하들과 언론 앞에서 자신이 바이든을 까는 것처럼 똥폼 잡다가 저런 외교참사가 난 것이 팩트!,False
@조현선-s2w,2025-08-18T06:55:08Z,2,김은혜도 수사대상이다,False
@따구뿔,2025-08-18T06:55:04Z,3,검찰만큼이나 판사들이 고여 썩은 물이됬다,False
@피니쉬-o4i,2025-08-18T06:54:55Z,1,멧돼지 잘못은 지가 하고 여러사람 피해주는 건 참 나쁜놈!!!<br>평생 감옥에서 썩어라!!!,False
@배뜨맨-i2p,2025-08-18T06:54:36Z,0,재판이 개판이다...이눔의 판사가 제일루 나뻐..,False
@jykim7308,2025-08-18T06:54:30Z,0,역사상 최고의 진상 대통령,False
@rest80-40s,2025-08-18T06:54:30Z,0,ㅂㅅ ㄷㅈㄹ ㅅㅎㅇ ㄷㅇㄷ.,False
@이파란이,2025-08-18T06:54:26Z,0,제2의 권력 아부자 김은혜가 나오지 않도록<br>후속조치 꼭 해주세요<br>Mbc,False
@바나나우유-z5m,2025-08-18T06:54:23Z,0,윤석열 대변한 다릉 언론들은 뭐했나??? 나도 MBC다 라고 했어야지요...언론 개혁이 필요한 이유다,False
@minna2363,2025-08-18T06:54:21Z,0,그때는 느꼈고 지금은 아주 뼈저리네....박근혜 수사로부터 도대체 뭘 배운건지.. <br>정상인이라면 혹시라도 보수진보의 중간에서 국민통합을 이룰지도 모른다라는 기대를 했다는게 기가 찬다. <br>그래도 웃기게도 당신은 영웅이네.....그리도 단단한 국힘의 실체를 드러내고  이젠 해산시킬거니...,False
@silee6420,2025-08-18T06:54:17Z,0,부부사기단 윤돼와 줄리 사혀아님 무기징역 감혀없는!!,False
@user-qi7hd7ky7x,2025-08-18T06:54:14Z,0,판사도 문제임 <br>정부는 그렇다 쳐도 <br>명확하게 따지는건 판결인데 <br>모르면 모른다고 할것이지 아니라고  판시하는건 피해자 이익으로 판결해야하는 법 위반이지 <br>실제로 타국민 앉혀놓고 받아쓰기해봐라,False
@0109jean,2025-08-18T06:54:04Z,0,와!!어쩜 이런 인간 쓰레기 긴 대통령 이 되서ㅠ,False
@nick_choi5338,2025-08-18T06:53:50Z,0,아~~저 면상때기 안봤으면...,False
@chl3171,2025-08-18T06:53:45Z,0,부당한 지시에 옷벗을 각오한놈은 단한놈도 없었구나 !!  복지부동 공무원놈들 🔥,False
@2N2-m7b,2025-08-18T06:53:40Z,0,"잘못은 술꾼이 했는데<br>국가 기관들이 술꾼과 요부에게는 아무말도 못한 게 나라냐고.<br>나라가 개판이었네<br>국민 세금으로 개에게는 60만원씩 지급하더니<br>정작 세금내는 국민에게는 1월한장  지급 안 했고,<br>사법부의 판사들은 시급히 조치를 해야 함.<br>개판인 인간들이 판사라니",False
@소망이-m6d,2025-08-18T06:53:38Z,0,더러운놈 하나가 나라 망치고  국가적 손해   개망신...... 종신형 때려라,False
@이파란이,2025-08-18T06:53:35Z,0,국민 세금 낭비하러 변호사도 최고 비싼 수임료로 지급하고<br>이런 낭비건을 알면서도<br>광복 80주년 기념행사비로 시비 비난을 만들어?<br>(딱 맞는 단어를 찾는중)<br>쓰레기하치장  국힝이 살려 발버둥<br>지금 처리해야함<br>지금 처리 못하면<br>담엔 어떤 곰팡이로 자라날지 모름,False
@심영-c6o,2025-08-18T06:53:35Z,0,윤석열은 정말 미친놈.. 할말 없게 만드는 저 순수한 병신 짓거리,False
@문민호-r4l,2025-08-18T06:53:31Z,0,날뛰는 돼지 새끼가 우리에 갇혔구나.  돼지를 추종하는 빈대들도 같이 싹다. 바베큐로,False
@이파란이,2025-08-18T06:53:25Z,0,국민 세금 낭비하러 변호사도 최고 비싼 수임료로 지급하고<br>이런 낭비건을 알면서도<br>광복 80주년 기념행사비로 시비 비난을 만들어?<br>(딱 맞는 단어를 찾는중)<br>쓰레기하치장  국힝이 살려 발버둥<br>지금 처리해야함<br>지금 처리 못하면<br>담엔 어떤 곰팡이로 자라날지 모름,False
@meoguriang,2025-08-18T06:53:01Z,0,"정말 웃기지. 저 문장을 보면, &quot;국회에서 이 XX들이 승인 안 해주O OOO X팔려서 어떡하나&quot;에서<br> &lt;승인 안 해주고 날리면 X팔려서&gt;으로 보나,  아니면, &lt;승인 안 해주면 바이든 X팔려서&gt;로 보나, <br>그 X팔리는 주체는 무조건 바이든임,ㅋㅋ 그리고 이 XX들은 명백하게 미국 의원들을 지칭한 것임,ㅋㅋ <br>결국 바이든이 맞냐, 날리면이 맞냐가 중요한 게 아님,ㅋㅋ 중요한 건 미국 대통령과 의원들을 상대로 비속어를 쓰면서 비하한 것임,,<br>국제 외교 현장에서 한미동맹을 훼손하는 엄청난 짓을 저질러 놓고서, 그걸 무마하기 위해, 바이든 날리면 듣기평가로 바꿔치기 한 것임, <br>&quot;한미동맹을 훼손하고, 국민을 굉장히 위험에 빠뜨리는 일&quot;은  MBC가 한 게 아니라, 윤석열이 외교현장에서 한 것임.ㅋㅋ",False
@연금술사-z6n,2025-08-18T06:52:56Z,0,10석열  머리에 두건씌우고 올가미줄 걸어라~,False
@Arg-hs6vf,2025-08-18T06:52:52Z,20,판사가 썩었다,False
@guyhsu1,2025-08-18T06:52:38Z,1,날리면으로 들리는 사람들 귀구멍에 모두 못을 박아 버려야 함..,False
@그대로-g6p,2025-08-18T06:52:38Z,5,당시 해당자들 모조리 구속 수사해야한다,False
@이규원-f7r,2025-08-18T06:52:37Z,0,진상을 밝혀서 윤석열이 한 짓들에 대한 처벌을 제대로 해야한다.<br>언론 출신의 언론탄압인이라니.... 역시 이나라의 쇠말뚝 조선일보 출신이로구나~!!!!,False
@JSHONG-lr6vg,2025-08-18T06:52:31Z,0,나라의 품격을 개꼬라지로 만든 놈들...!<br>니들 나머지 인생도 개꼬라지로 살아라...!<br>아~~ 욕 처먹으면 오래 살긴데.....쩝!,False
@tigerstarlee6484,2025-08-18T06:52:17Z,189,저 엉터리 소송에 들어간 혈세는 누가 책임져야 할까요?? <br>국민세금을 허투루 사용하게 된 조사와 징계가 있어야합니다.,False
@김동일-w1u4z,2025-08-18T06:52:16Z,1,석렬이와 거니는 대통령 당선되면 무조건 계엄으로 평생 해쳐먹을 생각이었던듯,False
@큰바다-o5d,2025-08-18T06:52:15Z,0,저놈들 요지경일세 요지경,False
@renie488,2025-08-18T06:52:14Z,6,치졸함이 상상을 초월하는 인간~~~,False
@김창선-t7w,2025-08-18T06:52:10Z,0,강훈 저 인간 관상봐라.,False
@윤보한-o1g,2025-08-18T06:51:53Z,0,어떻게 저리 뻔뻔 할 수 있을까,False
@금선화-i8c,2025-08-18T06:51:48Z,10,저들은 하나같이 부끄러움도 몰라,False
@ilrtgyip,2025-08-18T06:51:48Z,0,어 그래... 조선일보 출신이구나...,False
@항송-i2k,2025-08-18T06:51:29Z,0,입벍,False
