author,published_at,like_count,text,is_reply
@이성석-b4j,2025-08-18T16:39:53Z,0,이재명이 지지율 빠지는거 안보이냐? 자기 편은 다 풀어주냐? 위안부 할머니들 지원금을 참나.....이게 나라냐?,False
@ssiibb,2025-08-18T16:38:35Z,0,교도소에서 빤스입고 드러누울넘 날리면으로 개사기극 그냥 허접한 인생 ㅋ,False
@seankang6360,2025-08-18T16:36:30Z,0,볼수록 진상이네,False
@나이스필-q1n,2025-08-18T16:32:28Z,0,윤씨 시절 판사들 판결은  참  이례적인게 많네~  이러니 판새라고 욕먹지~,False
@APROBONG,2025-08-18T16:28:04Z,0,법과 절차 따위는 개나 줬구만,False
@영영-i6j,2025-08-18T16:26:30Z,0,멧돼지는 때려 잡는게 맞습니다.<br>길길이 날뛰는 멧돼지는 더 그렇습니다.,False
@내가제일잘나가-p2o,2025-08-18T16:25:45Z,0,신발럼이 주둥이 조심하지 않고 막 떠들어 놓고는 엄한 방송사에 책임을 떠 넘기는 추잡한 짓을 서슴치 않고 했으니. 저걸 수장이라고 뽑아놨으니 나라가 개판이지.,False
@y.davidcho2791,2025-08-18T16:25:24Z,0,야당 탄압이 아나라 잘못을 탄압하는거예요.,False
@김리처드-j4c,2025-08-18T16:25:00Z,0,그냥 미친놈이 였어,False
@random-f5c2o,2025-08-18T16:22:02Z,0,강훈 전 조선일보,False
@심심유툽,2025-08-18T16:21:34Z,0,사법개혁은 꼭 필요합니다 개법관들,False
@hyt9351,2025-08-18T16:20:50Z,0,지겹다,False
@naya-w9s,2025-08-18T16:14:31Z,0,이제 썩은 것들을 도려내고 새롭게 만들어야 합니다.,False
@내란의뿌리를뽑자-p7k,2025-08-18T16:10:16Z,0,진상 윤석열과  진상 김은혜를 고소하자!  <br>그리고 쓰레기 판결을 내란 판사도 청산할 대상이다!<br>대한 민국에 이런 쓰레기 판사가 없도록 사법걔혁을 이루어야 한다!,False
@박세진-g5j,2025-08-18T16:10:04Z,0,판사도 검사도 청력에 문제가 있다<br>이런 놈들이 법을 다룬다는건 상당히 위험하다 해임시켜야 된다,False
@DK-ys5oi,2025-08-18T16:08:05Z,0,MBC 말고 다른언론은 권력의 개인가? 윤석열은 소송비용 일체 물어내고 명예훼손비용까지 물어라!!!,False
@minwolf-q9h,2025-08-18T16:07:10Z,0,윤어게인 패거리가 서부지법 때려부순 이유가 성지호였구나.. 썩어도 어떻게 저렇게. ㅉㅉ,False
@대한민국헌법수호,2025-08-18T16:06:59Z,0,이나라 법치는 개판사 시벨넘이 가장 큰 문제임,False
@MdL-p9s,2025-08-18T16:00:05Z,0,검사 시절 어떤 방식으로 검사질을 했는지 보인다 보여~,False
@한세종-d3d,2025-08-18T15:59:58Z,0,도리도리는ㅋㅋㅋㅆ.ㅂ 진짜 명품이다,False
@안진범-l5w,2025-08-18T15:58:15Z,0,윤석열은 그냥 인간이 아니라 그냥 미처날뛰는 살인마 자자체이고 국힘은 함께  날뛰는 무리 검찰은 윤석열의 개 법원도 국힘의 하수인들의 모임이며 교회는 윤석열 사상교육  담당 언론은 윤선열의 나팔수,False
@MegaSammea,2025-08-18T15:58:02Z,0,진짜 저때 김은혜 싸다구 날리고 싶었다,False
@gagimi,2025-08-18T15:57:52Z,0,싹 다 잡아서 사형 시켜야됨,False
@sangrocklee8612,2025-08-18T15:56:46Z,0,"<a href=""https://www.youtube.com/watch?v=DShnMYo2CXE&amp;t=12"">0:12</a> 도리도리 못하게 못으로 고정시켜 놓으면 안되나요?",False
@이예이-g2p,2025-08-18T15:55:35Z,0,재판관이 법 대신 권력에 아부나 하니 이 모양이 됐지,False
@Wtigfg1,2025-08-18T15:55:26Z,0,공정과상식이 없던 세상,False
@eie28,2025-08-18T15:55:10Z,0,"윤석렬 자체가 우리나라를 위험에 빠뜨린 쓰레기지.  역대 제일 무능, 더러운 카르텔, 최악의 비리들, 무능한&amp; 매국노 관리들 임명...  진짜 나라가 너무 많이 망가졌다.",False
@유재한-h4o,2025-08-18T15:54:30Z,0,온국민은 제대로 들리는데<br>쓰래기들 귀는 틀리구나<br>한심한것들,False
@youngp5010,2025-08-18T15:48:00Z,0,공수처에서 진상 수사 해라,False
@peacewonderful4700,2025-08-18T15:45:19Z,0,똥 싼 시키가  벌떡 벌떡 화를 낸다더니...<br>그 냄새를 맡은 사람은 기분이 좋을까?<br>전 국민을 화나게 한 사건의 시작!!!,False
@Aiden.K,2025-08-18T15:45:07Z,0,역시 조선,False
@darkmoon70,2025-08-18T15:42:05Z,0,김은혜 요즘 뭐하냐? 비행기 날리나?,False
@danalee9946,2025-08-18T15:41:46Z,0,진짜 나쁜!!! 정말 저러고도 찍다니ㅜㅜ,False
@김영배-f2p,2025-08-18T15:36:52Z,0,저러리ㆍ사법부는ㄴ사라져야할ㆍ사법부네,False
@naroo617,2025-08-18T15:34:17Z,0,진짜 쓰레기 같은,False
@user-efb55eh838,2025-08-18T15:34:06Z,0,김건희 보필하게 같은방에 넣어줘라 꼬붕역할  좋아하는데,False
@투구준,2025-08-18T15:29:21Z,0,아이큐가 높던 말던  후에~ 다 멍청한 짓보다 더 더러운 짓인지 다 벌을 받게 되는데<br>국짐들 그 것들은  아직도 오리발에 징글징글하다<br><br>이걸 느릿느릿 질질 끄는 조사 판결이  다 판사의 책임도  다가온다 벌이 <br><br>결론은 판사들이 모든 걸 쥐고있었다는 증거인데 아직도 그냥 두는 민주당 해결력 실망스럽지..<br>방시혁도 처벌한다 하더니  갑자기 국민임명식에 초대하질않나??  말만 처벌한다 조사한다 검토한다 하더니 아직도 조용함 <br>이런 걸 봐서 민주당 말만 떠들고 해결은 남이 해주길 바라는 이기적인 상태  뭐라도 확실하게 하는게 지금까지 보이질않네..,False
@woonbeejiang4242,2025-08-18T15:26:25Z,0,지난 윤정부는 어떻게 한결같이 진상들만 한데 모아 놓은 듯~~~  하긴 국짐당 사람들만 보아도 ~~~   철저히 조사해서 실뿌리까지 모조리 뽑아야...,False
@김봉석-q4z,2025-08-18T15:22:17Z,0,쪽,False
@deil-t1p,2025-08-18T15:21:56Z,1,ㅎㅎㅎ 주변인들이 칼춤을 추었구나????<br>모지리들..... 조작과 날조.....,False
@초록빛석양,2025-08-18T15:21:31Z,0,저늠의 도리도리,False
@자연-f2l,2025-08-18T15:17:28Z,1,저 양아치놈 더 이상 안봐서 속이 시원. 입만 열면 거짓말에 남을 괴롭히는게 취미인 놈인지라 결국 감옥에서도 빤쓰 난동 .,False
@n006-s2u,2025-08-18T15:16:03Z,0,그놈의 격노,False
@JenniferHappy195,2025-08-18T15:15:45Z,0,개석렬...영원헤 감옥에.,False
@storm2513,2025-08-18T15:15:21Z,0,보면 볼수록 인간이하의 인간이다,False
@밝음,2025-08-18T15:14:06Z,0,나라를 완전 개판으로 운영했네,False
@보리보리-e7y,2025-08-18T15:11:23Z,0,윤건희가 나라를.쥐락펴락하니 대한민국 전체가. 섞어 문드러 졌구나 윤건희 사형시켜야 합니다,False
@한정우-i1p,2025-08-18T15:10:09Z,0,뻔뻔한종자.,False
@kennykim5498,2025-08-18T15:08:44Z,0,국민을 이렇게 무시하는데 여기에 참여한 모든놈들 반드시 색출해서 처벌하여야 한다!!!!!,False
@체게바라-z7t,2025-08-18T15:07:18Z,0,상처를 남긴게 어디 언론 뿐이랴..<br>온 국민 기억속에 트라우마를 새겨 논 인간인데..,False
@traveljiny7195,2025-08-18T15:05:19Z,1,참담하다.,False
@로그아웃-n5v,2025-08-18T15:05:18Z,0,"윤도리도리, 윤멧돼지, 윤술꾼, 윤거짓말쟁이......<br>인간이 기본이 안되어있는데....그것을 옹호하는 자들은 도대체 어떤 뇌구조를 가지고 있을까? <br>인류과학을 위해 다 잡아다가 뇌연구를 해봐야 한다....",False
@r___h-lv,2025-08-18T15:07:09Z,0,재명이 좋아하는 사람들 뇌구조도 이해가 안가 ㅠㅠ,True
@사람-j6j9q,2025-08-18T15:04:41Z,0,쯧쯧쯔...,False
@유흥민,2025-08-18T15:02:02Z,0,성지호판새 잊지맙시다!!!!!!!,False
@facilitymanagement8955,2025-08-18T15:00:50Z,0,에라이 도리도리야....  그래 안하무인 니 무식한 성질대로  날뛰다가 이제 감방 만족하냐?  이 모든 것이 니가 쌓은 업보다. 누굴 원망하겠냐. 언감생심 대통령이 웬 말이라더냐. 지금쯤은 후회라도 하려나?    혹  아직도 계엄에 대한 일말의 미련이나 희망이 있는 것은 아니겠지? 아무튼 더운 감방 생활 잘 적응하고 사형 달게 받아라.,False
@얼짱12,2025-08-18T15:00:41Z,0,저런게  대통령이었다니  빵에서 펑생써거야,False
@유흥민,2025-08-18T15:00:24Z,1,판사새기도 나쁜놈이네,False
@blacksunstudio6278,2025-08-18T15:00:12Z,0,어디서부터 얼마나 썩은거냐,False
@고려은단-t8g,2025-08-18T15:00:11Z,0,강훈 말대로 선을 넘는 보도하는 조센일보는 폐간이 정답이네 ㅋㅋㅋㅋ,False
@얼짱12,2025-08-18T14:58:46Z,0,윤서결   지가 죄를 저질러 놓고,False
@이문숙-n8h,2025-08-18T14:58:24Z,0,이사건이 소송할 일인지 ...언제부터 우리나라가 매번 소송으로 문제해결하는 국가가 됬을까.이런문제를 타협을 못한다는게 큰 사람이 없는듯.,False
@ziiz9499,2025-08-18T14:56:57Z,0,내란동조자들이지.. 엄벌하라,False
@OneRepublicc-x1y,2025-08-18T14:56:51Z,0,성지호 판사는 귓구녕이 막혔냐????,False
@user-ew1xy1rl8u,2025-08-18T14:52:43Z,0,자기 얼굴에 붙어있는 입으로 한 말은<br>분명히 바이든이었는데  왠 날리면이라니  낮술 처 드시고 아무생각없이 씨부린넘이 책임져야지,False
@아우토반-s8r,2025-08-18T14:49:12Z,0,내란정권의 범죄자들  한놈도  놓치지 말고  다 잡아들여야 한다.<br>나라를 망하게 하려다 국민들이 들고일어나 탄핵을 외치자  국가반란까지 일으켜  국민들에게 총을 겨눈 사악한 반국가정권<br>이제  그동안 벌어졌던 국정농단 수사도  강력하게 펴야 한다.<br>국가반란죄 심판은 당연히 혹독하게 처단하고 <br> 다른 국정농단 부패범죄들도 봐주고 덮으려 하지말고  전부 찾아내서 응징을 해야 된다.<br>국가시스템이  전부 무너져 내린 3년이었다,False
@언론개혁검찰개혁.데,2025-08-18T14:48:02Z,0,"💢 좋빠가   정권당시  ,,  오징어껨    흥행으로      <br>      넷플회장  방한이   있었지요 ,,,   <br>💢  공직자  신분으로     내부자정보 ,   사전정보 악용       <br>       주식투자   부를  축적  하셨던분들     반드시    조사가  필요합니다   !!!!    특히  ,,,      !!!!    특히  ,,,   당시  좋빠가  💢 아가리혀도     !!!!    필히    조사   하시길  !!!!",False
@동진김-h6b,2025-08-18T14:47:22Z,0,사실 이게 말이 안된다 무슨 판독불가야 어디 감정소인지 모르지만 만약 진짜 판독 불가면 때려쳐라 니들이 무슨 전문가냐 내귀엔 너무 또렸한데 그게 판독 불가냐 판독불가라고한 전문가 새끼들이나 판독불간데 사과하라고한 법원이나 그런식으로 할거 같으면 죄안되는게 어딨냐 완전히 원님재판이다 원님 마음대로 죄가 됐다 안됐다 아러면서 사법부의 독립성 운운하면서 지들 기득권에만 관심있는 몰염치의 끝판왕들 법원이 아니라 복마전이다,False
@cdk18818,2025-08-18T14:45:03Z,0,다 발골해서 허위사실 협박으로 처벌 해야지 빨리 수사 해라,False
@Futer-y8h,2025-08-18T14:43:03Z,0,감투에.. 완장 차면. 이상하게 변한다더니.. 아니. 원래 그런 사람이였을 수도..,False
@이상훈-f4d1p,2025-08-18T14:42:58Z,0,성지호 판사 또 이사람이네 드러온곳에 안끼는곳이 없구나,False
@홍익인간-w3l,2025-08-18T14:42:41Z,0,자~~~~ 이젠 윤석열이 MBC를 어디에다 팔아먹으려한 것인지 수사해야지요. <br>윤석열은 MBC 팔아먹을 결심을 하지않고서는 모든 뉴스방송사들은 놔두고  저렇게 콕 찍어 MBC를 노렸을 리가 없습니다.,False
@Futer-y8h,2025-08-18T14:41:34Z,0,본인이 한 말에 책임도 안지느느무책임하고 무능한자가. 나라를 망쳤네요.,False
@미쉘의쉬운수학,2025-08-18T14:41:12Z,0,진상을 밝히라고? ㅁㅊ 서겨라 니가 진상이야 ㅇㄴㅇ,False
@신은경-d3c,2025-08-18T14:40:33Z,0,윤석열이 정권은 정말 무법천지네요...!!,False
@바비-u7p,2025-08-18T14:40:15Z,0,햐여튼  일제 부터   나라  망치는데  조선일보가  빠지면  안되지..이참에   조선일보  폐간 해라,False
@범규박-x3r,2025-08-18T14:39:03Z,0,너네는 내가 찍었으니까 뒈져야지?,False
@바비-u7p,2025-08-18T14:38:49Z,0,훼손같은소리하네.....빤스  줄리한테  손해배상청구  합시다,False
@부동산스터디-g6x,2025-08-18T14:33:50Z,0,김정은보다 더악질,False
@BNE1005,2025-08-18T14:31:08Z,0,사실과 다른 보도? ㅎㅎㅎ,False
@jjk7482,2025-08-18T14:29:14Z,0,진짜 엠비씨는 잘못된 세상과 싸울줄 아는 진짜 언론이다<br>참 안쓰럽고 고맙고 그르네,False
@KS-lw3ku,2025-08-18T14:24:51Z,0,민주주의를 위해 조기 사형,False
@user-vc1uw3uy4w,2025-08-18T14:24:04Z,0,강훈-낮짝에 뻔뻔함과 무식함이 그대로..최태형-저런게 법률인.. 김은혜-모든걸 알면서 뻔뻔하게 거짓말. 2차 재판 무죄나오면 이 인간들에게 520억 손해배상 물려서 디지게 만들어야 한다.,False
@mhy7603,2025-08-18T14:23:59Z,0,아이고 왜 거니랑 결혼했나 싶었더니 결국 혼신의 구라가 통했던 모양이군. 구라 구라 구라,False
@권희철-b1i,2025-08-18T14:23:50Z,0,지록위마의 현대팜,False
@HJ-zl8hs,2025-08-18T14:23:12Z,0,분조장이었네 내란수괴,False
@권희철-b1i,2025-08-18T14:23:08Z,0,ㅅㅅ,False
@쿠가-c5u,2025-08-18T14:19:51Z,0,하남자 이런 인간이 대한민국을 좌지우지하고 우린 당했고 ㅜ.ㅜ,False
@김명선-b1r,2025-08-18T14:17:30Z,0,멍멍이 판사 파면해라......,False
@Hyunwook,2025-08-18T14:10:18Z,0,미국 가서 카메라 앞에서 욕은 지가 해놓고 진짜 개슥기도 저런 개슥기가 또 있을까 싶네,False
@aspelled,2025-08-18T14:09:36Z,0,깡패 조직 정부 였지,False
@boganjung,2025-08-18T14:06:29Z,0,정말 상식과 기본기라곤 찾아볼 수 없는,False
@세라정-t6c,2025-08-18T14:06:29Z,0,윤석열 정부ㅡ 국힘 ㅡ 정말 한편의 드라마를 본것같음,False
@js675,2025-08-18T14:06:22Z,0,판사 경질 제도를 빨리 만들어야,False
@yz4939,2025-08-18T14:05:55Z,0,"저노므정권에서는  사람을  볼수가  없다.   전부  개들뿐인듯,   똥을  묻히고  묻힌  개들.<br>그  개들이  짖으니까   모든  기관들이  슬슬  기기  바쁘다.",False
@billiejean_is_not_my_lover,2025-08-18T14:05:50Z,0,이제 김은혜가 감옥가야한다는 데에 동의하시는 분은 추천 바랍니다.,False
@dkhyanggi,2025-08-18T14:05:29Z,1,네 주둥이가 위험에 빠뜨린거 같은데?😅😅😅😅,False
@쑤기-w4o,2025-08-18T14:03:40Z,0,윤씨 돈으로 소송하지?거짓말도사,False
@박성민-g3j2p,2025-08-18T14:02:48Z,0,생긴대로 논다<br>강훈인가지 몬지,False
@newbiikim2005,2025-08-18T14:01:31Z,0,10썩열 하는짓이 그렇지 요즘2찍들 하는짓이랑 똑같음,False
@박성민-g3j2p,2025-08-18T14:00:36Z,0,모지리,False
@우째이런일이-d3l,2025-08-18T13:58:45Z,0,관련자 모두 처벌해야합니다,False
@leelee-h2f,2025-08-18T13:57:13Z,0,정성을 다하는 국민의 방송 MBC 문화방송.,False
@독도는Korea,2025-08-18T13:57:04Z,0,전국민 듣기평가 귀머거리 만든 내란당 해체하고 사법부 징계하라,False
@Enrehfdl,2025-08-18T13:55:12Z,0,&quot;김은혜 털면 뭐든 나온다&quot;에 1표,False
@yeunggyeungbang5093,2025-08-18T13:53:27Z,0,"MBC는 관련자 반드시 소송해서 승소하셨으면 좋겠습니다.<br>손해배상, 명예회복 모두.",False
@호이-k7m,2025-08-18T13:52:01Z,0,본인이 말실수해놓고 책임을딴데로넘기는행위는정말비겁한넘 이다!!!!!!,False
@musso290sr,2025-08-18T13:51:40Z,0,도리도리 ㅋㅋ,False
@jch-w8q,2025-08-18T13:50:29Z,0,MBC의반격  이제 그들에게 금융치료 구상권 청구해라,False
@TimeCapsule_Admin,2025-08-18T13:49:56Z,0,저런 자식이 대통령이 된 순간부터 이런일은 예상했어야 했어,False
@scn8310,2025-08-18T13:49:28Z,0,개자석,False
@mjkim-lo1zt,2025-08-18T13:48:42Z,0,국민모두 바이든이라는데 마음대로 날리면이라고 개소리하는것들 모두 구속시켜야한다,False
@xbulsara,2025-08-18T13:48:09Z,0,강훈.. 역시 관상은 과학,False
@mjkim-lo1zt,2025-08-18T13:47:16Z,0,자 이쯤되면 조선일보 응징해야지,False
@미토마슈팅바보,2025-08-18T13:46:40Z,0,숨쉬는 하나하나가 다 거짓입니다,False
@flashlightning4374,2025-08-18T13:44:42Z,0,생긴대로 논다는 말의 뜻을 이해하게됨,False
@유지명-r2i,2025-08-18T13:43:42Z,0,"천 번, 만 번을 들어도 바이든이다.<br>인간이 양심을 버리면 짐승보다 추악해진다.",False
@김병희-z3j,2025-08-18T13:43:07Z,0,쓰레기 다 모아놨네,False
@문정옥-g4t,2025-08-18T13:42:53Z,0,입만 벌리면  거짖말.<br>역겨워.,False
@charmj7301,2025-08-18T13:42:16Z,0,인간이 저렇게 뻔뻔할수 있다는게 저게 이 나라 대통령이었다는게 소름끼쳐요 철면피,False
@crom9325,2025-08-18T13:41:57Z,0,성지호 판사의 몰상식한 판결.이런 판사는 사라져야함,False
@김병희-z3j,2025-08-18T13:41:53Z,0,멧돼지 새끼는 양심조차없네,False
@YuhanJin-q3g,2025-08-18T13:41:37Z,0,독재하려고 지랄발광을 했네 아주!😡,False
@MOJ-v4o,2025-08-18T13:39:00Z,0,이제와서? 외교부 직원이 참 딱하다! 왜 사냐?,False
@독도는우리땅-z6f,2025-08-18T13:37:11Z,0,"조선일보 왈.. 일본천황폐하 만세, 김일성장군 만세.. 대한민국 반 국가세력의 선봉부대.. 반드시 폐간하고 모든 자산은 국고로 환수해야 ..",False
@changkeunmin4638,2025-08-18T13:33:46Z,0,더러워 토나온다!!,False
@김승국-g7u,2025-08-18T13:32:44Z,0,에잇 눈 버렸네<br>퉤퉤퉤.<br>저 꼬라지를 다시 볼 줄이야. 모자이크 합시다. 개짜증 납니다.,False
@redalder2137,2025-08-18T13:32:26Z,0,성지호 귀머거리 색뀌,False
@뽀빠이-w5g,2025-08-18T13:31:15Z,0,빤스  하수인 은해도  빤스  벗겨라,False
@js-tr7im,2025-08-18T13:30:29Z,0,개병신도 대통령이 될 수 있는나라. 나도 시켜줘. 계엄은 안 할게 ㅋㅋㅋ,False
@pigbear105,2025-08-18T13:30:20Z,0,여러모로 정신없던 ㅅㄲ였음,False
@어슬렁-v,2025-08-18T13:29:01Z,0,"김은혜=십상시, 간신, 부역자 등등.. 그저 권력에 빌붙어 기생하는 사람. 없어져야될 정치인",False
@권연순-z1u,2025-08-18T13:28:05Z,0,김은혜진짜혐오스런인간이었어<br>날리면<br>웃겨라,False
@이겸윤,2025-08-18T13:27:38Z,0,국민을 바보로 알아도 정도가 있지..,False
@kirium4u,2025-08-18T13:26:34Z,0,그때 이야기를 해야지 왜 지금들 커밍아웃을...ㅜㅜ,False
@siegkim3488,2025-08-18T13:26:19Z,0,어휴 저 미친놈 지가 사고치고 지가 화내네,False
@먹저씨,2025-08-18T13:26:07Z,0,"조선일보는 폐간시키고, 소송건 외교부,감사해서 징계해야지",False
@jyddow,2025-08-18T13:25:18Z,0,윤석열은 그 주둥아리를 생각없이 나불대는 스타일때문에 지가 지무덤을 파는 놈임,False
@y-joo,2025-08-18T13:24:10Z,0,윤성열 대가리는 장식인갑다,False
@상훈황-o1g,2025-08-18T13:23:25Z,0,ㅋㅋㅋㅋ 가즈아,False
@youngman3828,2025-08-18T13:22:58Z,1,윤석열 이놈은 입만 열면 거짓말..,False
@from9996,2025-08-18T13:21:13Z,0,역시 추악한 조선일보 무리들 답다  조선일보 무리들아 니들은 부끄럽지 않는가 니들의 집단지성 이라는 수준은 어찌 하나같이 이따위냐 정말 인간 같지도 않은 더런 인성들만 골라서 모은 집단 조선일보,False
@Jabak자박,2025-08-18T13:19:39Z,0,이것도 특검해서 다 집어넣자. 그리고 논리적으로 말이 안되는 판결하는 판사를 징계 및 처벌하는 입법이 필요하다.,False
@Dkfmgl,2025-08-18T13:19:19Z,0,전국민의 청각력 이상을 유발한 희대의 코미디. Mbc의 희생이 너무 컸다. 장하다 Mbc!!!,False
@dolce95,2025-08-18T13:18:59Z,0,변호사비을 세금으로 쳐쓰고.....다 토해내라.,False
@쭈니-g1l,2025-08-18T13:18:14Z,0,와~ 얼굴 딱 한 번 보고 전형적인 매국의 상이라는 생각이 딱 드는 사람은 처음이네,False
@나나시-c6w9S,2025-08-18T13:16:30Z,3,사법부 문제 너무 너무 많다,False
@김서진-m3e6g,2025-08-18T13:16:13Z,0,김은혜와 윤씨의 작품 날리면,False
@khy6464,2025-08-18T13:15:29Z,0,판사 검사 다 특검하여 구속하라,False
@lz200051,2025-08-18T13:13:03Z,0,김은혜 입이 대한민국 언론 자유를 막았다.<br>김은혜는 사퇴가 아니라 전 국민에게 사죄하고  <br>꺼져라!<br>김은혜 ..,False
@tony6141,2025-08-18T13:11:14Z,0,"사법부도 문제 투성이네... 배심원제 도입하고, 법원장과 대법관은 국민투표로 뽑는 사법개혁이 하루빨리 필요하다고 본다.",False
@jwc7839,2025-08-18T13:10:19Z,3,아 진짜 쪽팔린다,False
@rollercoaster1361,2025-08-18T13:09:56Z,0,입만열면 구라가그냥나와,False
@harrykim217,2025-08-18T13:09:01Z,0,"정말 양아치다. <br>그냥 실언이라고 인정하고 사과하면 될 것을. <br>그 많은 사람들이 거짓말을 하게 만들고, 자신의 허물을 덮으려 하는가. <br>정말 양아치다.",False
@SYi-xj8bv,2025-08-18T13:07:10Z,0,바이든 날리면 보고 윤싸이코 바로 손절함. 하나를 보면 열 가지를 안다는 속담은 예나 지금이나 변함없는 진리임,False
@김용호-p6b,2025-08-18T13:05:50Z,0,앞으로 재판을 Al가<br>먼저하고 배심원 을<br>선발 심의해야 된다고 생각합니다,False
@prettyjulia98,2025-08-18T13:05:46Z,1,참 무능하고 뻔뻔했던 윤정권. 그에 맞장구 친 무능한 재판부.,False
@zzulungwo3089,2025-08-18T13:04:10Z,0,동맹을 훼손? 네가 해외 나가는것 자체가 동맹 훼손이었다 빤쓰야!!!,False
@mark6767,2025-08-18T13:03:33Z,0,세상 소인배새끼,False
@수라닉-v9o,2025-08-18T13:03:24Z,0,듣지도 못하는놈이 무슨 남을심판한다고 판사하는지,False
@이종백-x8x,2025-08-18T13:03:20Z,0,미친놈들 억지를 부려도 ㄷㄹ쫄 놈들!,False
@cortezia111,2025-08-18T12:59:27Z,0,성지호 판사도 탄핵해야,False
@이은규-d5s,2025-08-18T12:59:24Z,0,언론개혁은 고의적 거짖허위 왜곡 뉴스부터 척결해야 합니다! <br>이들의 왜곡 뉴스로 인해 국민들은 피해를 봅니다!<br>MBC의 윤석열 보도는 사실로 보입니다.,False
@지금이순간-p6q,2025-08-18T12:56:30Z,0,한미동맹 훼손은 댁이했어~ 윤건희씨~,False
@wouldyoukim,2025-08-18T12:56:18Z,0,으이? 에? 어이? 으에?<br>이 뭐같은 소리 언제까지 들어야 하나,False
@GgirlFF,2025-08-18T12:56:00Z,0,참나.. 지금 생각해도 피가 거꾸로 솟는 느낌..<br>전국민이 다들었는네 그걸 정면 거짓말 우기기...ㅎㅎㅎㅎㅎㅎㅎㅎ<br>진짜 희대의 또라이 정부<br>와...  진짜 그걸 우기는 정부라니...,False
@info-y1k,2025-08-18T12:55:31Z,0,MBC MBC MBC 👍👍👍😢,False
@보리-d7s-l1k,2025-08-18T12:54:30Z,0,MBC역고소 ㄱㄱ,False
@yh-hx5bp,2025-08-18T12:52:39Z,0,"도리 도리 도리  시속 200km , 흥분지수도 시속 200km",False
@you_want_something,2025-08-18T12:52:08Z,0,ㅇㅇ,False
@powerajw1163,2025-08-18T12:52:05Z,0,전 정권 실세는 조선일보,False
@소젖-f9y,2025-08-18T12:52:00Z,0,김은혜 이것도 좀 털자,False
@왕조타파,2025-08-18T12:51:30Z,0,법과 원칙을 무시한 윤거니 사이비 정권의 당연한 몰락입니다.<br>검찰개혁 사법개혁 사이비 국짐해체 반드시 완수해야 할 과제입니다.,False
@흥신유,2025-08-18T12:50:49Z,0,나이가몇살들이신데불리한건기억이않나실까?어디서조은거는않배우고더러운것만배워서참기가막히네,False
@헤르세,2025-08-18T12:50:21Z,0,조선일보 ㅋ 진짜 문제가 크다,False
@11111mjjj,2025-08-18T12:50:01Z,0,김은혜가 최고 저질이었음,False
@user-ik1so4gb6n,2025-08-18T12:49:26Z,0,진짜또라이짓 많이했다<br>다<br>처벌확실히 받아라<br>말도안되는짓이 쯧,False
@호구와떠-i5o,2025-08-18T12:48:43Z,0,"온국민이 바이든으로 들었는데,,,  맘에안든다고 국민을 탄압한거랑 머가 다른가",False
@잘살자-m1b,2025-08-18T12:47:30Z,1,저거 날리면으로 들리는 사람은 진짜 x새x다 정말 욕도 아깝다,False
@jeanramen,2025-08-18T12:46:47Z,0,2찍들은 지금도 언론탄압이 아니라 MBC가 외교분쟁을 일으킨 거라고 주장하고 아직도 바이든으로 안 들린다고 함. 심각한 아집이고 세뇌임.,False
@vex238,2025-08-18T12:45:51Z,0,"어우.. 다시봐도 저질스럽고 뻔뻔스러운 인간.. 지 주둥이로 내뱉은 경박한 언행을 전국민이 다 듣고 봤는데, 거짓말하고 죄를 뒤집어 씌우고 억압하고 부끄러운줄도 모른다. 저런 것을 지지하고 지배받고 싶어하는 인간들이 더 경멸스럽다.",False
@n922360,2025-08-18T12:44:39Z,0,조선일보 폐간,False
@블랙카프,2025-08-18T12:43:27Z,0,윤의 그 똥깨들 지금 뭐하지.<br>은혜는 어디가서 MBC 출신이라 말하면 인쓰다.,False
@sm97943,2025-08-18T12:42:38Z,0,엠비씨가 나라를 구했다<br> 감사합니다,False
@문용섭-k1w,2025-08-18T12:42:23Z,0,걸음걸이도 어쩜 저렇게 뒷골목 깡패보다 못할까?,False
@임미순-e2p,2025-08-18T12:41:36Z,0,자신의 입도 컨트롤 안되는 자가 내 조국의 대통이었다는 것이 참으로 부끄럽소이다.,False
@류쾌걸,2025-08-18T12:41:12Z,0,지가 잘못해놓고 남탓하는 찌질이 새끼..,False
